{
  "builder_version": "prospective-card-tracking-v1",
  "finalized_at_utc": "2026-09-29T00:20:02Z",
  "official_definition": "FINAL_VALID_PUBLISHED_LANE_STATE_STRICTLY_BEFORE_GAME_KICKOFF",
  "official_wagers": [
    {
      "final_lane_state": {
        "american_odds": -130,
        "away_team": "TEN",
        "book": "DRAFTKINGS",
        "canonical_headline": {
          "american_odds": -130,
          "book": "DRAFTKINGS",
          "ev": -0.05040492349506204,
          "game_id": "2026_03_TEN_NYG",
          "lane": "HIT_RATE",
          "line": null,
          "market": "MONEYLINE",
          "market_probability": 0.5460453954604539,
          "matchup": {
            "away_team": "TEN",
            "home_team": "NYG"
          },
          "model_probability": 0.734269121650432,
          "play_through": {
            "line": null,
            "price_american": -131
          },
          "recommended_units": 0.75,
          "reliability": "LOW",
          "selection": "NYG",
          "state": "BET",
          "support": "SUPPORTED",
          "trust_probability": 0.6401572585554429,
          "value_at": null,
          "warnings": []
        },
        "ev": -0.05040492349506204,
        "exact_offer_identity_id": "offer-76568c4e3225789a9d569bdd",
        "game_id": "2026_03_TEN_NYG",
        "home_team": "NYG",
        "kickoff_at_utc": "2026-09-27T17:00:00Z",
        "lane": "HIT_RATE",
        "lane_key": "hit_rate",
        "line": null,
        "logical_recommendation_id": "logical-b2d9a2331423d10b23f87c02",
        "market": "MONEYLINE",
        "market_probability": 0.5460453954604539,
        "model_probability": 0.734269121650432,
        "normalized_selection": "NYG",
        "normalized_side": "home",
        "play_through": {
          "line": null,
          "price_american": -131
        },
        "portfolio_duplicate_of_lane": null,
        "portfolio_stake_suppressed_reason": null,
        "recommended_units": 0.75,
        "reliability": "LOW",
        "roof_state": {
          "status": "AVAILABLE",
          "support": "SUPPORTED"
        },
        "selection": "NYG",
        "selector_version": "v1",
        "state": "BET",
        "support": "SUPPORTED",
        "trust_probability": 0.6401572585554429,
        "value_at": null,
        "wager_identity_id": "wager-16b4a3968f45abd2b7ed23ec",
        "warnings": []
      },
      "first_appearance": {
        "american_odds": -148,
        "line": null,
        "publication_id": "publication-1c0f9018af70dce331832ffb",
        "published_at_utc": "2026-09-24T00:08:25.190317Z",
        "source_product_sha256": "1c0f9018af70dce331832ffb4e7874bf2a84f708a702195d49f2cef81f21fc91"
      },
      "game_id": "2026_03_TEN_NYG",
      "kickoff_at_utc": "2026-09-27T17:00:00Z",
      "lane": "HIT_RATE",
      "lane_key": "hit_rate",
      "official_wager": {
        "american_odds": -130,
        "away_team": "TEN",
        "book": "DRAFTKINGS",
        "canonical_headline": {
          "american_odds": -130,
          "book": "DRAFTKINGS",
          "ev": -0.05040492349506204,
          "game_id": "2026_03_TEN_NYG",
          "lane": "HIT_RATE",
          "line": null,
          "market": "MONEYLINE",
          "market_probability": 0.5460453954604539,
          "matchup": {
            "away_team": "TEN",
            "home_team": "NYG"
          },
          "model_probability": 0.734269121650432,
          "play_through": {
            "line": null,
            "price_american": -131
          },
          "recommended_units": 0.75,
          "reliability": "LOW",
          "selection": "NYG",
          "state": "BET",
          "support": "SUPPORTED",
          "trust_probability": 0.6401572585554429,
          "value_at": null,
          "warnings": []
        },
        "ev": -0.05040492349506204,
        "exact_offer_identity_id": "offer-76568c4e3225789a9d569bdd",
        "game_id": "2026_03_TEN_NYG",
        "home_team": "NYG",
        "kickoff_at_utc": "2026-09-27T17:00:00Z",
        "lane": "HIT_RATE",
        "lane_key": "hit_rate",
        "line": null,
        "logical_recommendation_id": "logical-b2d9a2331423d10b23f87c02",
        "market": "MONEYLINE",
        "market_probability": 0.5460453954604539,
        "model_probability": 0.734269121650432,
        "normalized_selection": "NYG",
        "normalized_side": "home",
        "play_through": {
          "line": null,
          "price_american": -131
        },
        "portfolio_duplicate_of_lane": null,
        "portfolio_stake_suppressed_reason": null,
        "recommended_units": 0.75,
        "reliability": "LOW",
        "roof_state": {
          "status": "AVAILABLE",
          "support": "SUPPORTED"
        },
        "selection": "NYG",
        "selector_version": "v1",
        "state": "BET",
        "support": "SUPPORTED",
        "trust_probability": 0.6401572585554429,
        "value_at": null,
        "wager_identity_id": "wager-16b4a3968f45abd2b7ed23ec",
        "warnings": []
      },
      "resolution_state": "OFFICIAL_BET",
      "source_product_sha256": "2ab0c9c65b9a034c26aa61337d4b465c2f3110545f3a65f155d5be2dbbddc6a5",
      "source_publication_id": "publication-2ab0c9c65b9a034c26aa6133"
    },
    {
      "final_lane_state": {
        "american_odds": -130,
        "away_team": "TEN",
        "book": "DRAFTKINGS",
        "canonical_headline": {
          "american_odds": -130,
          "book": "DRAFTKINGS",
          "ev": -0.05040492349506204,
          "game_id": "2026_03_TEN_NYG",
          "lane": "BALANCED",
          "line": null,
          "market": "MONEYLINE",
          "market_probability": 0.5460453954604539,
          "matchup": {
            "away_team": "TEN",
            "home_team": "NYG"
          },
          "model_probability": 0.734269121650432,
          "play_through": {
            "line": null,
            "price_american": -131
          },
          "recommended_units": 0.75,
          "reliability": "LOW",
          "selection": "NYG",
          "state": "BET",
          "support": "SUPPORTED",
          "trust_probability": 0.6401572585554429,
          "value_at": null,
          "warnings": []
        },
        "ev": -0.05040492349506204,
        "exact_offer_identity_id": "offer-76568c4e3225789a9d569bdd",
        "game_id": "2026_03_TEN_NYG",
        "home_team": "NYG",
        "kickoff_at_utc": "2026-09-27T17:00:00Z",
        "lane": "BALANCED",
        "lane_key": "balanced",
        "line": null,
        "logical_recommendation_id": "logical-4d92b9f8273fe15d52f691b8",
        "market": "MONEYLINE",
        "market_probability": 0.5460453954604539,
        "model_probability": 0.734269121650432,
        "normalized_selection": "NYG",
        "normalized_side": "home",
        "play_through": {
          "line": null,
          "price_american": -131
        },
        "portfolio_duplicate_of_lane": "hit_rate",
        "portfolio_stake_suppressed_reason": "DUPLICATE_EXACT_OFFER",
        "recommended_units": 0.75,
        "reliability": "LOW",
        "roof_state": {
          "status": "AVAILABLE",
          "support": "SUPPORTED"
        },
        "selection": "NYG",
        "selector_version": "balanced-price-bounded-v2",
        "state": "BET",
        "support": "SUPPORTED",
        "trust_probability": 0.6401572585554429,
        "value_at": null,
        "wager_identity_id": "wager-66e8e054461f039683d9e866",
        "warnings": []
      },
      "first_appearance": {
        "american_odds": -130,
        "line": null,
        "publication_id": "publication-771a3bbd8b9321dafa613c7f",
        "published_at_utc": "2026-09-25T00:08:24.697745Z",
        "source_product_sha256": "771a3bbd8b9321dafa613c7f333dfcf709e64d4be29e5b1221bb54eed3d70fdd"
      },
      "game_id": "2026_03_TEN_NYG",
      "kickoff_at_utc": "2026-09-27T17:00:00Z",
      "lane": "BALANCED",
      "lane_key": "balanced",
      "official_wager": {
        "american_odds": -130,
        "away_team": "TEN",
        "book": "DRAFTKINGS",
        "canonical_headline": {
          "american_odds": -130,
          "book": "DRAFTKINGS",
          "ev": -0.05040492349506204,
          "game_id": "2026_03_TEN_NYG",
          "lane": "BALANCED",
          "line": null,
          "market": "MONEYLINE",
          "market_probability": 0.5460453954604539,
          "matchup": {
            "away_team": "TEN",
            "home_team": "NYG"
          },
          "model_probability": 0.734269121650432,
          "play_through": {
            "line": null,
            "price_american": -131
          },
          "recommended_units": 0.75,
          "reliability": "LOW",
          "selection": "NYG",
          "state": "BET",
          "support": "SUPPORTED",
          "trust_probability": 0.6401572585554429,
          "value_at": null,
          "warnings": []
        },
        "ev": -0.05040492349506204,
        "exact_offer_identity_id": "offer-76568c4e3225789a9d569bdd",
        "game_id": "2026_03_TEN_NYG",
        "home_team": "NYG",
        "kickoff_at_utc": "2026-09-27T17:00:00Z",
        "lane": "BALANCED",
        "lane_key": "balanced",
        "line": null,
        "logical_recommendation_id": "logical-4d92b9f8273fe15d52f691b8",
        "market": "MONEYLINE",
        "market_probability": 0.5460453954604539,
        "model_probability": 0.734269121650432,
        "normalized_selection": "NYG",
        "normalized_side": "home",
        "play_through": {
          "line": null,
          "price_american": -131
        },
        "portfolio_duplicate_of_lane": "hit_rate",
        "portfolio_stake_suppressed_reason": "DUPLICATE_EXACT_OFFER",
        "recommended_units": 0.75,
        "reliability": "LOW",
        "roof_state": {
          "status": "AVAILABLE",
          "support": "SUPPORTED"
        },
        "selection": "NYG",
        "selector_version": "balanced-price-bounded-v2",
        "state": "BET",
        "support": "SUPPORTED",